v1,v2, , , 
NARCISISTA,"No lo sentiria como mio, pero si sentiria algo de lastima, porque algun sufrimiento no se lo desea ni a su enemigo, en mi posicion lo comprenderia.", , , 
NARCISISTA,"Creo que si podría sentir ese sufrimiento, a todos en un momento nos a pasado cosas malas y es inevitable no ponerse en los zapatos de otros pero sin embargo considero que cada persona merece lo que da y si hace el bien entonces obtendrá el bien", , , 
NARCISISTA,Creo que toda persona  ve el beneficio propio antes de pensar en los demás ... no obstante debemos se más empáticos por aquella persona sea enemigo o quien sea poniéndonos en lugar de ellos al igual que ellos a nosotros... Pero solo son luchas de  perspectivas de ambos lados , , , 
NARCISISTA,"Nunca he tenido enemigos. Pero si alguien me hace un mal a propósito, y esa persona sufre por algún factor que no tiene que ver con el problema entre nosotros, entonces no me alegraría ni nada. Y si esa persona necesita mi ayuda de forma sincera, entonces le daría la mano. 3", , , 
NARCISISTA,"No podría entender el sufrimiento de esa persona, a solo que experimentemos el mismo sufrimiento, pero esta siempre recordar que si una persona pide tu ayuda, así el problema o sufrimiento no sea tuyo, poder ayudarlo en todo lo que este a tu alcance.", , , 
NARCISISTA,"No he tenido un enemigo real hasta ahora, pero siendo sincera creo que no lo sintiera como mío, y pues dentro de lo que más pueda lo ignoraría pero si tendría que ayudarlo y es algo muy importante si lo haría.", , , 
NARCISISTA,"No podría sentir su dolor como mío, pero sí lo que está pasando es algo grave o fuera del motivo por el cual somos enemigos, si mostraría empatía por él y no desearía que alguien se alegre de mi sufrimiento. ", , , 
NARCISISTA,Inevitablemente sentiría empatía. No podría alegrarme por el sufrimiento de una persona al menos que alguna vez lo haya provocado a mí o a un tercero., , , 
NARCISISTA,"La verdad no, porque capas tiene un sufrimiento muy fuerte, y no podemos sentir eso, lo que haría es ignorar y cambiar el tema ya que, si es mi enemigo quiero una pele justa no aprovecharme de la situación de el.", , , 
NARCISISTA,"El hecho que sea mi enemigo no quiera decir que no tenga sentimientos, asi que si se deja ayudar pues lo hago", , , 
NARCISISTA,"No sentiría nada, simplemente si está en mi posibilidad ayudar, lo hago, sino, para la próxima será.", , , 
NARCISISTA,"En lo personal, yo no le tengo rencor a nadie y considero que tampoco tengo enemigos, pero de ser el caso trataría de ayudarlo en lo que pueda tampoco quisiera entrometerme mucho.", , , 
NARCISISTA,Trataría de pensar mucho y ayudaría a la familia con apoyo moral , , , 
NARCISISTA,"Incluso esto se puede ver en los prejuicios de la sociedad, así tu tengas menos que alguien que te envidie, este te seguirá envidiando aún tu estés en la miseria debido a que eres feliz y para la otra persona esto es malo. ", , , 
NARCISISTA,"No tengo ningún enemigo, pero si hablamos en alguna suposición no sintiera nada al respecto, si veo que necesita mi ayuda, lo ayudo porque a pesar de todo somos humanos y cualquier persona puede cometer errores.", , , 
NARCISISTA,"No lo sentiría como mi sufrimiento, sin embargo tampoco sentiría felicidad por la angustia de otra persona, eso no es ser una persona ética", , , 
NARCISISTA,"No tengo ningún tipo de enemigos, ayudaría a cualquier persona conocida o desconocida sin ningún problema, claro está si esta persona desea mi respectiva ayuda. De lo contrario, de no necesitar o querer mi ayuda, realmente me daría igual.", , , 
NARCISISTA,"Pienso que actuando en consecuencia, el dolor ajeno se trate de quien se trate es algo malo, en cierto modo pensaria que el karma le estaría devolviendo el daño causado, pero si sentiría algo de tristeza por esa persona.", , , 
NARCISISTA,"Pues no considero a nadie como mi peor enemigo, pero soy de la idea que no debemos desearle el mal a nadie y ante esta pregunta mi pensar es que no lo sentiría como mío pero si me gustaría ayudarlo aunque sea de manera indirecta.", , , 
NARCISISTA,"No he tenido enemigos, ni espero tenerlos pero en casos así no lo sentiría como si el problema fuera fuera mío, pero si daría un apoyo de fortaleza hacia esa persona que está sufriendo", , , 
NARCISISTA,"No sentiría el dolor como mio...bueno sentiría empatía y si hay algo en lo que lo pueda ayudar lo haría sin ningún problema ya que si a mi me considerarán como ""mi peor enemiga"" no me gustaría que se burlen de esa desgracia.No hagas lo que no quieres que te hagan.", , , 
NARCISISTA,Simplemente no le deseo el mal a nadie pero no disfrutaría ante el sufrimiento de un ser humano pero lo tomaría como un merecido porque todo en esta vida se paga, , , 
NARCISISTA,"En lo personal. No podría sentir ese sufrimiento del cual esté pasando. Pero de lo que estoy segura, que si necesitaría mi ayuda, se la brindaré. Ya que a veces pasamos por muchas circunstancias y no sabemos quienes podrán ayudarnos. Del quien menos se lo espera.", , , 
NARCISISTA,"Creo que depende mucho de mi situación con esa persona, tal vez lo que sufre puede ser el famoso “karma” por sus malas acciones no me alegraría por ello pero tampoco lo aplastaría más, dejaría que el solucione sus problemas, pero si esté problema es fuerte si le ayudaría", , , 
NARCISISTA,"Existe una pragmática que dice, que sin la maldad no tuviera lógica la felicidad, alegrarse por el sufrimiento de otro ser humano no es correcto ni ético. Bien se dice en el argot popular, existe un Karma que si hemos hecho mal o bien el tiempo es el único que lo hace pagar.", , , 
NARCISISTA,"En los personal no le guardo rencor a nadie, pero dependiendo de la condición en la que se encuentre siempre y cuando no me causen problemas en un futuro, lo tomaría como un sentimiento propio para mi mismo", , , 
NARCISISTA,"Depende de que tipo de sufrimiento sea, por ejemplo si esta sufriendo por alguna enfermedad de algún padre o hermanos entonces lo ayudaría, pero si es un acto que él mismo se provocó y por eso esta sufriendo entonces no lo ayudó para que escarmiente.", , , 
NARCISISTA,"Ignorar, es algo que no haría, porque a pesar de todo lo que a causado sigue siendo una persona igual que nosotros, sin embargo si llego hacerlo me convertiría en mi propio peor enemigo, pero siempre y cuando haya ese perdón mutuo para así poder ofrecer esa ayuda.", , , 
NARCISISTA,"Depende mucho de la situación, ya que la causa del sufrimiento puede ser la consecuencia de algún acto negativo realizado por esa persona, si no es así se lo podría ayudar de alguna manera.", , , 
NARCISISTA,"No tengo enemigos y si fuera así, ignoraria lo que le pasa a noser que sea dms fuerte y me pida ayuda, haría lo que esta en mis manos.", , , 
NARCISISTA,"Si fuese una persona objetiva y poco rencorosa podría ser empatica con esa persona, sin embargo como ser humano aveces no se controlan esos aspectos, yo creo que dependería de que situación sea la que se esté aconteciendo", , , 
NARCISISTA,"Hoy en día es irrelevante llevar riñas con alguna persona, pues por más daño que me haya hecho alguien no le deseo el mal, es mejor vivir bien con uno mismo a qué llevar rencor en el corazón y el daño que haya hecho tarde o temprano vuelve (karma)", , , 
NARCISISTA,"No sentirlo como mío.. pero de igual manera buscaría ayudarle o simplemente escucharle, en eso está la empatía", , , 
NARCISISTA,"No compartiría el sufrimiento, tampoco me alegraría por su situación, solo lograría asimilar lo ocurrido, si la situación implica ayudar sería de manera indirecta.", , , 
NARCISISTA,Lo sentiría y trataría de ayudarle si es de él/ella dejarse ayudar., , , 
NARCISISTA,"Pues yo digo que aunque sea mi enemigo debería ayudarlo, unque yo diría que necesito que el pase un poco de karma pero tampoco soy haci de vengativa haci que si lo ayudaría.", , , 
NARCISISTA,"Yo no me sentiría feliz o complacido. Pero, por otra parte, tal vez me sentiría bien si fuese algo que se lo merecía. Aunque nunca me diera placer el sufrimiento de alguien más.", , , 
NARCISISTA,No lo puedo sentir como si fuera mi pero si sentiría compacion por el y que pues desiaria que lo que este pasando pues se termine su sufrimiento, , , 
NARCISISTA,No le deseo el mal a nadie pero ya en sentido así a mi pensar no kisiera saber d esa persona cambiar del tema, , , 
NARCISISTA,Dependiendo si mi enemigo es malo en tonces nesesita aprender de las consecuencias para que cambie algo de en su personalidad. Caso contrario el sufrimiento no se los desearía a nadie., , , 
NARCISISTA,"Respeto genera respeto, simplemente me mantendría al margen, pero si necesita mi ayuda lo apoyaría porque tampoco sería tan inhumano, a la final nunca sabes las vueltas que puede dar la vida, y en algún momento tendrás que necesitar de esa persona.", , , 
NARCISISTA,"Puede ser, pero influyen muchos factores ya que se puede concidera las circunstancia en la que ocurren las sircustancia es decir si se lo métrica o no, porque depues de todo sigue siendo humano", , , 
NARCISISTA,"Pues la verdad, no lo sentiría como mío pero tampoco sería insensible, lo ayudaría para mostrarle que ante cualquier problema existe bondad y que se puede cambiar", , , 
NARCISISTA,"Nadie puede sentir el sufrimiento de alguien más, por mas que intente ponerse en su lugar , ya que los sentimientos son diferentes en cada ser. Asi que no podria imaginarme como podría estar sintiendose, si necesita ayuda se la brindaría y sino tiene que ver conmigo,no me metería", , , 
NARCISISTA,Es un tema muy delicado, , , 
NARCISISTA,"Probablemente no lo sienta como mío, pero trataría de ser empática con él/ella, si se encuentra sufriendo por algo que puedo tener la solución en mis manos y lo puedo ayudar lo hago, si no, lamentablemente, me haría de lado.", , , 
NARCISISTA,"Creo que no hay que desearle el mal a nadie, así esa persona sea tu peor enemigo. No podría llegar a sentir su sufrimiento como mío pero aún así el poder de la empatía me haría sentir algo por lo que buscaría ayudarla.", , , 
NARCISISTA,"Si esa persona permite ignorar por el momento disputas pasadas y el acercamiento es sincero podría sentir su dolor o sufrimiento como si fuese mío, caso contrario me daría lastima su caso o lo comentaría muy por encima y pasar al siguiente tema. ", , , 
NARCISISTA,"Considero que ninguna, ya que considero que le sufrimiento de cada persona moldea y forja el carácter y la templanza  de cada persona ya que tendrá que tener el valor y coraje suficiente para sobrellevarlo y seguir adelante y con el tiempo superarlo ", , , 
NARCISISTA,"Es claro que la respuesta que todos esperan es que no es bueno sentirse bien por el sufrimiento ajeno y más aún cuando se trata de un enemigo, es lo que se debe decir, sin embargo la realidad es que muchas personas si disfrutarían el sufrimiento de su peor enemigo.", , , 
NARCISISTA,"Muchos decimos que vengarnos ante nuestro peor enemigo nos va a satisfacer, pero cuando ya se cumplió la venganza y lo acabaste, la sensación de haber ganado dura poco, lo mejor es no recordarlo, y tan solo ignorarlo, para así no tener la mente ocupada en basuras.", , , 
NARCISISTA,"No tengo enemigos, pero si ese fuera el caso, posiblemente ignoraría el tema, ya que por alguna razón fuerte se convirtió en mi enemigo.", , , 
NARCISISTA,"siendo este el caso, ayudaría a la persona que no es de mi agrado, pero si no puedo hacer nada ante la situación simplemente lo ignoraría.", , , 
NARCISISTA,Eso depende de cada persona. En mi caso no le daría mucha importancia ya que no es mi vida y tampoco mi problema pero si se puede ayudar en algo se ayuda., , , 
NARCISISTA,"hasta el momento no he experimentado esa situación, pero poniéndome en la situación no podría sentir su  sufrimiento como mio,pero prefiriera ignorarlo y intentar cambiar a un tema que sea de su agrado", , , 
NARCISISTA,"Depende del ""¿por qué sea mi peor enemigo?""", , , 
NARCISISTA,"No podría sentirlo como mío pero tampoco me alegraría por lo malo que le pase, lo único que se Esque existe el Karma y tal vez lo esté pagando por eso lamentablemente uno tiene que pensar muy bien antes de hacerle daño a otra persona ", , , 
NARCISISTA,"No podría sentir su dolor como mío, porque en la vida si obras bien te irá bien, tan solo podría desearle la mejor de las suerte y seguir mi camino pues es mejor evitar.", , , 
NARCISISTA,Soy una persona que no guarda rencor ni mucho menos desea el mal a alguien y en este caso dejaría pasar el tema ya que me encuentro en paz y son problemas ni sufrimiento que no me corresponden., , , 
NARCISISTA,"No sentiría su sufrimiento como mío,  pero si empatía y si puedo le daría toda mi ayuda porque me imagino que no todos harían lo mismo y pensar que aquella ayuda vendría de la persona menos esperada. Simplemente tener humildad ante cualquier situación.3", , , 
NARCISISTA,"Dejando de lado la parte ""curuchupa"", definitivamente no se haría esperar el regocijo ante el ""sufrimiento"" de mi peor enemigo, sin embargo, la cuestión es, qué se necesita para que yo considere a alguien mi enemigo, quizás una traición, un ataque físico, o algo peor.", , , 
NARCISISTA,Si es el sufrimiento de mi peor enemigo no podría sentirlo como mío porque si el o ella tiene ese nombre es porque se la gano lo llame asi  solamente observaría como el karma o dios o la vida misma castiga gente que hace mal a otras personas .Solamente tendría pena por el o ella. , , , 
NARCISISTA,"Eso depende del tipo de persona! Ya que no todos pensamos iguales. Creo yo que dependiendo del daño al que se vea sujeto el enemigo de cualquier persona está gozaría aunque sea de manera mínima, los seres humanos somos muy directos al momento de expresar nuestros sentimientos.  ", , , 
NARCISISTA,"Considero que me mantendría al margen, aunque por un lado si me sentiría mal, porque de todas formas es un ser humano y le duele, pero por otro lado, no me creería capaz de ir y mostrar apoyo hacia esa persona cuando sé que esta de alguna u otra forma me hizo daño. ", , , 
NARCISISTA,Buena pregunta! Vive y deja vivir., , , 
NARCISISTA,"No lo sentiría tanto como sufrimiento mío, porque creo yo que cada persona tiene lo que se merece ya sea bueno o malo, si está persona esta sufriendo sólo trataría de no dar tanta importancia y sólo decir que su situación mejore.", , , 
NARCISISTA,Sinceramente es una difícil  pregunta para los que no les  deseamos  el mal  ni al peor  enemigo. Pero  prefiero  ignorar el tema  el muy delicado para mi, , , 
NARCISISTA,"A mi parecer yo creo que cada persona debe pagar o sufrir lo que ha hecho, pero no me alegraría por el sufrimiento ajeno tan solo lo ignoraría y seguiría en mis cosas", , , 
NARCISISTA,"Si se gano la reputacion de ser ""MI PEOR ENEMIGO"" mucho daño nos hicimos mutuamente asi que me pareceria hipocrita sentir el dolor como mio. Y como la pregunta es ignorar mas no sentirse feliz por el dolor ajeno, entonces mi respuesta es: SI, YO IGNORARIA.5", , , 
NARCISISTA,Esto varia de acuerdo al asunto primero me pondría en su lugar y establecería una oportunidad para ayudarlo pero si esta persona persiste en lo mismo cambiaria de tema., , , 
NARCISISTA,"Prefiero cambiar de tema, pero tampoco me alegría del mal de otra persona! Ya que también es un tema que se basa en las circunstancias!", , , 
NARCISISTA,"Un ""Peor enemigo"" es, odio, maltrato y rivalidad mutua. La pregunta no se trata de ayudar, es si me pusiera en su lugar o ignorarla. Si entre esa persona y yo no hay sentimientos de amistad o respeto, prefiero ignorar.", , , 
NARCISISTA,"En la actualidad no tengo enemigos, si he observado el dolor de Personas malas, dónde yo e pensado que todo en esta vida, es como un búmeran, lo que das recibes", , , 
NARCISISTA,"Sinceramente prefiero cambiar e ignorar el tema. Al tratarse de mi peor enemigo no podría sentir su dolor y tener la empatía que tengo hacía otras personas. Si está dentro de mis posibilidades, quizá lo ayudaría. Pero más allá, prefiero evitar involucrarme.", , , 
NARCISISTA,"Dependería de lo que este sufriendo a muchas cosas le alegaría al karma como factor de lo que le sucede, por ende tendría nula empatía, por otro lado aplicando la frase: ""no se lo deseo ni a mi peor enemigo"" tendria empatía si ha sufrido la muerte de alguien por ejemplo. 4", , , 
NARCISISTA,Solo diría KARMA!!!!!!  Y luego ignoro el tema :3  , , , 
NARCISISTA,"Para ser sincera, no me afectaria ya que no es una persona a la que le tengo afecto, esto no quiere decir que me alegre de su desgracia tampoco, pero preferiria no meterme e ignorar el tema. ", , , 
NARCISISTA,Cambiar el tema porque no tengo enemigos y si lo tuviese solo desearía que sea muy feliz, , , 
NARCISISTA,"Pues a cada quién cosecha lo que siempre, y personalmente prefiero evitar. Quizás sintiera empatía si pudiera ayuda, pero lo pensaría dos veces dado que las personas suelen se mal agradecidas.", , , 
NARCISISTA,"No tengo enemigos, no sentiría ese sufrimiento como mío, el karma se encarga de pasarle factura a cada persona por los malos actos que cometa, si obras bien serás recompensado sino tendrán su castigo, cada persona recibe lo que da, depende de nosotros mismos si sufrimos o no.", , , 
NARCISISTA,"Yo no tengo enemigos, considero a algunas personas mis haters(gente que trata de hacerme daño con comentarios o acciones) pero si me llego a enterar de que le pasó algo malo, o que la está pasando mal, pues se podría actuar de dos formas, todo depende.", , , 
NARCISISTA,"No podría sentirlo como mío pero tampoco me  alegraría por lo que este pasndo lo único que  diría esque existe el Karma y tal vez lo esté pagando por las cosas que aya hecho Muchos decimos que vengarnos ante nuestro peor enemigo nos va a satisfacer, pero no es cierto.", , , 
NARCISISTA,Depende del tipo de persona que realmente somos. En este caso prefiero ignorar debido a que no me gusta guardar rencor con nadie y muchos menos estar alegre por sufriendo ajeno. Creo que cada persona paga sus acciones en algún momento, , , 
NARCISISTA,"ante una situación como esta mi actuar dependería de la gravedad del hecho, en general no soy una persona de rencores y si llego a tener una clase de ""enemigo"" pues simplemente no me importaría lo que le sucediese, ignoraría totalmente la existencia del mismo.", , , 
NARCISISTA,Si esa persona me ha hecho mucho daño pues no me importaría lo que le pase., , , 
NARCISISTA,Cambiar el tema porque el nunca va ha sentir tus sentimiento y solo sentirá rencor, , , 
NARCISISTA,Yo y mi peor enemigo nunca comeremos jutos, , , 
NARCISISTA,"Para que yo lo considero un enemigo realmente se debió haber ganado ese calificativo, por lo tanto simplemente ignoraría el tema. ", , , 
NARCISISTA,"Muy compleja la pregunta tratándose de sentimientos dónde muchas veces el odio predomina pero en estos casos el dolor de una persona que nos hizo daño o hablo mal de ti, sería muy complicado ponerme a sentir su sufrimiento.", , , 
NARCISISTA,Si  fue una persona   k se porto supermal  comnigo no me  alegra  y tampo  me  voy  a sentir mal   , , , 
NARCISISTA,Pues es  mejor ignorar ya que no es tu problema y peor si es de tu peor enemigo... Pues ya sería si el tema ya se basa en lo personal... mientras tanto se prefiere no meterse en problemas que no sean de uno mismo., , , 
NARCISISTA,Prefiero primero ignorar el tema porque algunos lo ven como metida, , , 
NARCISISTA,Preferiría ignorar el tema y seguir con mi vida., , , 
NARCISISTA,"Si busca una respuesta sincera y hasta cierto punto ""satisfactoria"", tan solo puedo decir al respecto a modo de réplica, que sin importar con lo mucho o poco que hayamos tenido que lidiar debido a ""x"" individuo, lo que verdaderamente interesa es conseguir la satisfacción que deja", , , 
NARCISISTA,"Si es mi peor enemigo es por algo, no?Trataría de ser empática", , , 
NARCISISTA,"Considero que ninguna, ya que no puedo sentir su dolor como mío y aunque sea un enemigo por algún motivo tampoco le deseo el mal, simplemente ahí que respetar como se siente esa persona y que en un futuro todo ese dolor será un aprendizaje para su vida", , , 
NARCISISTA,"Para considerar a una persona como mi peor enemigo, es por que en el pasado me  tuvo que ocasionar mucho daño, y al enterarme de que dicha persona estas sufriendo. En este momento podria decir que me seria totalmente indeferente", , , 
NARCISISTA,"Me daria tristeza por mi enemigo, pero el sufrimiento de el no lo tomaria como mio ya que al ser personas muy diferentes prefiero seguir con mis objetivos y que Dios lo ayude a resolver su problema por que yo no lo haré.", , , 
NORMAL,"La verdad es que no sabría como actuar, no tengo enemigos... ", , , 
NORMAL,"Independientemente del problema que exista entre ambas personas, no está bien alegrarse de un mal sin embargo sería importante recalcar el aprendizaje que dejará este sufrimiento a esa persona.", , , 
NORMAL,"Hay veces en las que no se puede sentir empatía por una persona que de algún modo nos ha hecho daño, sin embargo, creo que esto tampoco implicaría sentir algún tipo de satisfacción por su sufrimiento. Si es muy grave la situación y además esa persona en algún momento llegó a ser ", , , 
NORMAL,"importante en alguna etapa de mi vida, no me quedaría de brazos cruzados y ayudaría, de otro modo, simplemente lo ignoraría.", , , 
NORMAL,"El agrado o desagrado del dolor de otra persona es un reflejo de lo que está mal en mi, si alguien me hace daño es porque alguien ha agredido a esa persona antes, lo que vemos como venganza es la acción que trata de compensar una perdida, pero ella sólo el duelo la puede superar.", , , 
NORMAL,No quisiera ignorar a mi enemigo ya que aunque los dos seamos enemigos y tengamos diferentes gustos aún así me preocuparía por él aunque también dependiera de Qué tipo de sufrimiento tendría, , , 
NORMAL,"Todo dependería de la clase de sufrimiento que estaría pasando, porque si es la pérdida de un ser querido obviamente sentiría su dolor.", , , 
NORMAL,"por que  sentimos que alguien que nos lastima consideramos ya como un enemigo,  por que nos sentimos ""lastimados"" vivimos  rodeamos de estructuras donde matamos un flujo tan grande  para ver y sentir lo que la vida nos presenta para que se convierte en aprendizaje ", , , 
NORMAL,Los que sigue en el sendero de la venganza siempre terminan mal, , , 
NORMAL,"el sufrimiento no es de algo el cual podemos escapar, pero la empatia es lo que nos puede llevar a ser buenas personas, sin duda lo sentiria como un dolor propio", , , 
NORMAL,"Asta ahora no siento a nadie como enemigo, y aunque fuese asi, no lo podria ignorar", , , 
NORMAL,"Nunca he tenido enemigos, o si los tengo es lo tengo es lo que menos me importa, siempre trato ser buena persona para todos mis conocidos. No tomaría jamas el sufrimiento de mi "" enemigo"", como satisfacción para sentirme bien conmigo mismo.", , , 
NORMAL,"Pues en mi corta vida muchas personas me han lastimado, pero esto no quiere decir que me plazca ver como esas personas estén en una situación grave, al contrario los ayudaría ya que así soy yo, no guardo rencores a pesar de todo el daño. Dejare que la vida se encargue de ellos.", , , 
NORMAL,"no hay que enemistarse con las personas, porque en algún momento guardar odio o rencor hacia alguien es malo.. y aunque se tratase de un enemigo por decirlo así.. sentiría ese sufrimiento porque todos somos personas, todos somos iguales. en fin todos sentimos.", , , 
NORMAL,"la verdad a medida que vamos creciendo nos damos cuenta que tenerle rencor a alguien es por gusto ya que vamos madurando y cambiando nuestra manera de pensar,a mi parecer  si me sentiria mal si alguien que conosca, se encuentre en una mala situacion a pesar de nuestra diferencias", , , 
NORMAL,"No podría  sufrirlo como el mio, y tampoco se le puede desear el mal a alguien por muy mal momento que este pasando, siempre es bueno extender aquella mano amiga para sobrellevar la situación", , , 
NORMAL,"No he tenido ningún enemigo, pero si existiera el caso y esa persona pasa por algún momento de sufrimiento, trataría de sentir su dolor como si fuera mío y si estuviera en mis manos poder ayudarlo lo haría.", , , 
NORMAL,"Bueno, en la vida uno se hace amigos, pero sin darse cuenta ya hiciste enemigos. En ese caso si esa persona esta pasando por algo doloroso, jamas seria indiferente al sufrimiento del progimo sea quien sea, y oraria mucho porque le vaya bien", , , 
NORMAL,"Creo que se crea un vínculo entre dos personas  cuando existe una enemistad , yo si pienso que lo sentiría como mío ...y pues reflexionaría ante lo que está pasando y tendría la oportunidad de perdonar o disculpar como mejor pretexto .", , , 
NORMAL,"Éticamente, hacernos los ciegos frente a una situación adversa que está sufriendo alguna persona está muy mal, sin embargo, debemos ser conscientes del trato que  la misma nos brinda. En lo personal, yo si trataría de ayudarlo sin importar el daño que me haya hecho", , , 
NORMAL,"Las personas se podrán despreciar todo lo que deseen por distintas situaciones, pero aún hay esperanza que en cada persona ayude al prójimo que también le hizo daño sin importar el mal actuar", , , 
NORMAL,"Gracias por hablar de esta tema tan interesante, he tenido una mala experiencia con una persona. Pero a pesar de eso creo que aunque no estuvimos de acuerdo en muchas ideas pero si está sufriendo es normal que ayudó y siento lo mismo al final somos todos humanos", , , 
