NARCISISTA,RASGO_1,RASGO_2,RASGO_3,COMENTARIOS
SI,automotriz,,,"Subviraje: Deriva acentuada de los neumáticos del eje delantero que desplaza esta parte del vehículo hacia el exterior de la curva. Suele producirse en los vehículos de tracción delantera cuando se empieza a trazar y mientras se acelera en mitad de una curva. Se corrige reduciendo ligeramente la potencia que tienen que transmitir al suelo los neumáticos. Si el subviraje es muy acentuado y no se controla se produce una tendencia del vehículo a salir recto en una curva. En un vehículo con tracción trasera el subviraje se controla acelerando ligeramente hasta lograr que las ruedas traseras tiendan al sobreviraje. En un vehículo con tracción delantera se puede girar un poco más el volante al interior de la curva y acelerar ligeramente, la tracción del neumático hacia el interior de la curva reducirá el subviraje. Si el subviraje es muy acentuado, se tendrá que reducir progresivamente el accionamiento sobre el acelerador hasta que el neumático recupere adherencia con el suelo."
SI,automotriz,,,Supermarcha: Denominación que recibe un dispositivo colocado a la salida de la caja de cambios y que conseguía una relación de cambio muy larga. El sistema consiste en un nuevo tren de engranajes que se utilizaba en los vehículos norteamericanos para poder circular en carretera con el motor muy bajo de vueltas. Este sistema se dejo de emplear cuando los vehículos incorporaron la caja de cambios de cinco velocidades.
SI,automotriz,,,"Suspensión: Conjunto de elementos que se colocan entre las ruedas y la carrocería de un vehículo y sirven para absorber las irregularidades del terreno. La suspensión está formada por un elemento elástico (muelle, ballesta, aire) y un elemento frenante (aceite). El elemento elástico tiene la función de deformarse a compresión o a extensión cuando las ruedas pasan por encima de un bache o de un obstáculo en la calzada. El resorte transforma la energía cinética en potencial mientras se va comprimiendo. Luego tiene que soltar esa energía potencial y la transforma en energía cinética al estirarse. Al llegar el muelle a su longitud en reposo todavía queda energía cinética que origina su extensión y su nueva compresión. El muelle continúa extendiéndose y comprimiéndose hasta que la energía desaparece. El elemento frenante se encarga de transformar la energía que absorbe el muelle en calor al hacer pasar por un pequeño orificio a un líquido (aceite). El paso del aceite frena el desplazamiento tanto a compresión como a extensión. En la actualidad los resortes más empleados en automóviles son los muelles helicoidales y son frenados por los amortiguadores."
SI,automotriz,,,Suspensión autonivelante: Suspensión que mantiene constante la altura de la carrocería con respecto al suelo aunque las condiciones de carga del vehículo varíen. Este ajuste se realiza de forma completamente automática. Los sistemas más empleados son a través de un circuito hidráulico o por electroneumática a través de sensores de carga y de pulmones neumáticos que se hinchan levantando la suspensión.
SI,automotriz,,,"Suspensión de altura variable: al suelo. Este sistema se utiliza en vehículos todoterreno o muy deportivos para aumentar la altura libre al suelo o reducir el centro de gravedad del vehículo (bajar la carrocería). El sistema utilizado puede ser electroneumático a través de unos pulmones sobre las suspensiones de cada rueda y que se llenan de aire levantando el vehículo. Otro sistema es por medio de un circuito hidráulico que aumenta la presión del aceite en el circuito oleoneumático de la suspensión. La mayor presión reduce el volumen de las cámaras de gas que actúan como resorte pero posibilita la entrada de mayor cantidad de aceite al circuito, separando las ruedas de la carrocería y aumentando la distancia con respecto al suelo. Este sistema de suspensión puede ser manual o automático (solamente para reducir la altura de la carrocería al rodar a alta velocidad)."
SI,automotriz,,,SUV: Siglas de Sport Utility Vehicle para clasificar a los vehículos destinados al ocio como pueden ser ciertos todoterreno o pick-up.
SI,automotriz,,,T.B.N.: Siglas de Total Basic Number que es el Número Total de Basicidad. Se utiliza en relación a los lubricantes para indicar su capacidad de neutralización de los ácidos generados durante la combustión.
SI,automotriz,,,TCS: Siglas de Sistema de Control de Tracción. Que es un sistema que evita que las ruedas propulsoras patinen por un exceso de potencia.
SI,automotriz,,,TDI: Motores turbo Diesel de inyección directa con o sin bomba-inyector.
SI,automotriz,,,Tensor de emergencia: Mecanismo que se coloca en un anclaje del cinturón de seguridad y se activa en caso de accidente. Consiste en tensar el cinturón durante un corto espacio de tiempo para acercarlo todo lo posible al cuerpo de los ocupantes. Se consigue evitar que la holgura entre el cuerpo y el cinturón cause lesiones a los ocupantes. La inercia sobre el cuerpo es frenada rápidamente y no se acelera a causa del recorrido muerto por la holgura. Los tensores pueden ser mecánicos (por muelle) o pirotécnicos (por una pequeña carga explosiva) que son los más utilizados en la actualidad.
SI,automotriz,,,Termocontacto: Interruptor eléctrico accionado por temperatura. Los contactos pueden abrirse o cerrarse cuando se alcanza una determinada temperatura. Se emplean en el circuito de refrigeración del motor para activar el electroventilador del radiador cuando la temperatura es alta. También se emplean en los sistemas de climatización y de aire acondicionado para poner en funcionamiento diversos elementos en función de temperaturas.
SI,automotriz,,,"Termostato: Mecanismo empleado en el sistema de refrigeración para controlar el caudal de líquido refrigerante que se desvía hacia el radiador. Está formado por una válvula que se acciona por temperatura. La válvula está conectada a una cápsula llena de una sustancia muy dilatable (parafina). Con el motor frío, la válvula permanece cerrada y el líquido vuelve por otro conducto a la bomba impulsora. Al calentarse el motor, la parafina se dilata y la válvula se abre, el líquido puede pasar hacia el radiador, cediendo su calor a la atmósfera. Entre la posición de cierre y la de apertura completa, el termostato tiene infinidad de posiciones. De esta forma se puede regular el caudal de líquido que pasa al radiador, en función de su temperatura. Su apertura suele iniciarse hacia los 80-85ºC y finaliza en torno a los 90-95ºC."
SI,automotriz,,,"Titanio: Metal de gran ligereza, adecuada resistencia mecánica y muy resistente a la corrosión. Su empleo se reduce a los motores de competición (bielas, válvulas) porque su precio sigue siendo demasiado alto."
SI,automotriz,,,"TLEV: Siglas de Transitional low-emission vehicle que son utilizadas por el CARB para definir el primer nivel de vehículos que emiten emisiones contaminantes. Está seguido por los niveles LEV, ULEV, y ZEV. Esta categoría engloba a los vehículos que tienen emisiones por debajo de 0,25 gr/km en los óxidos de nitrógeno, 2,11 gr/km de monóxido de carbono y 0,078 gr/km de hidrocarburos y otros gases orgánicos."
SI,automotriz,,,TMC: Traffic Message Channel. Canal de Mensajes de Tráfico. Banda de radio dedicado exclusivamente a emitir mensajes de tráfico que son recibidos por los sintonizadores dotados de RDS (ver RDS).
SI,automotriz,,,Tolerancia: Diferencia de medidas permitidas en una pieza. Consiste en una medida máxima y otra mínima entre las que se tiene que encontrar la medida realizada para que una pieza se considere válida. En caso contrario esa pieza no cumple las especificaciones y tiene que ser rechazada. La tolerancia suele indicarse por medio de dos indicadores sobre la medida nominal de la pieza. Un indicador corresponde con la medida máxima y el otro indicador es para la medida mínima.
SI,automotriz,,,"Torsen: Tipo de diferencial que es utilizado en los vehículos de tracción total para repartir el par entre los dos ejes. Tiene la ventaja de repartir la fuerza independientemente de la velocidad de giro de cada eje, principal inconveniente de los demás tipos de diferenciales. Está formado por tres pares de ruedas helicoidales que engranan entre ellas por dientes rectos en sus extremos. El diente helicoidal engrana con el piñón central (uno por eje) y su funcionamiento se basa en la inclinación del diente helicoidal. Un engranaje helicoidal tiene la propiedad de la irreversibilidad, si la inclinación no es muy acusada, el acoplamiento entre un piñón y una corona puede se accionado desde los dos eje, pero si la inclinación del diente es muy acusada, el acoplamiento solamente puede ser accionado desde el piñón (tornillo sinfín). La misma inclinación del diente crea una fricción que arrastra a los piñones centrales. La capacidad de deslizamiento del diferencial Torsen está en función de la inclinación de los dientes. Este tipo de diferencial es capaz de transmitir más par a la rueda que menos gira en una curva, situación inversa a los demás tipos de diferenciales."
SI,automotriz,,,"TPMS: Tire Pressure Monitoring System. Sistema de Control de la Presión de los Neumáticos. Controla la presión de los mismos mediante sensores colocados en el interior de las válvulas, y activan un aviso si existe una pérdida de presión. En BMW se llama RDC y en Renault, SCPN."
SI,automotriz,,,"TPS: Denominación utilizada en los sensores que miden el grado de apertura del acelerador. Se emplea en los sistemas de alimentación electrónica del motor, tanto en los vehículos de gasolina como en los Diesel. Suele estar formado por un potenciómetro o resistencia variable en función de la posición del acelerador."
SI,automotriz,,,Tracción total: Dispositivo que permite la transmisión de potencia al suelo a través de todas la ruedas de un vehículo. Puede denominarse como cuatro ruedas motrices o 4x4 (ruedas del vehículo por ruedas propulsoras). Los vehículos convencionales consisten en dos ruedas motrices lo que sería un 4x2.
SI,automotriz,,,"Tracción total conectable: Denominación que recibe el sistema de tracción total que es seleccionable por el conductor. En funcionamiento normal se utiliza el vehículo como un dos ruedas motrices (menor gasto de combustible y menor desgaste de la transmisión y de las ruedas). Seleccionando la tracción total cuando la adherencia del terreno es muy reducida. Este sistema puede ser manual o automático. En algunos sistemas manuales, la tracción total se conecta sin diferencial entre los dos ejes. En este caso no se puede utilizar la tracción total en terreno con buena adherencia ni a velocidades superiores a 60 km/h. Los sistemas automáticos conectan la tracción total cuando el deslizamiento de las ruedas es excesivo."
SI,automotriz,,,Tracción total permanente: Sistema de tracción total que no puede ser desconectada. Este sistema se emplea en los vehículos de alta potencia que utilizan tracción total. Este tipo de vehículo tiene que disponer de diferencial central para compensar la diferencia de giro entre los ejes delantero y trasero.
SI,automotriz,,,"Túnel de viento: Instalación empleada para el desarrollo de la carrocería de los vehículos. Simula las condiciones aerodinámicas que afectan al vehículo a una determinada velocidad. Consiste en una habitación alargada o túnel que por medio de grandes ventiladores crean una corriente de aire por ella. El vehículo se coloca dentro del túnel y por medio de luz ultravioleta, espuma o humo se puede comprobar los flujos que sigue el aire cuando es apartado por la carrocería del vehículo. Los túneles de viento más modernos son capaces de simular condiciones atmosféricas adversas (lluvia o nieve) y alcanzar velocidades del aire de hasta 200 km/h."
SI,automotriz,,,"Turbocompresor: Dispositivo de sobrealimentación que puede utilizarse en los motores de gasolina o Diesel (donde goza de una gran aceptación). Consiste en comprimir el aire que entra al interior del cilindro empleando la energía cinética que tienen los gases de escape cuando salen hacia la atmósfera. El turbocompresor está formado por dos turbinas que giran solidarias a través de un eje. Una turbina es atacada tangencialmente por los gases de escape y tiene la salida central. La otra turbina recoge el aire de la admisión por el centro y lo impulsa para salir tangencialmente hacia el colector de admisión. Los turbocompresores tienen que estar perfectamente lubricados porque alcanzan altas temperaturas de funcionamiento (por estar en contacto con los gases de escape) y por girar a muy altas revoluciones (entre 100.000 y 150.000 rpm). El turbocompresor tiene su principal inconveniente en la falta de progresividad, a bajas revoluciones del motor, el caudal de aire que es impulsado es muy bajo. Mientras que cuando las revoluciones aumentan, el caudal de aire impulsado es mayor y el cilindro se llena mejor. El motor aumenta su rendimiento y sube rápidamente de vueltas, lo que aumenta la cantidad de aire que vuelve a entrar al cilindro. Este momento de aumento de eficacia del turbocompresor se produce de forma muy brusca (carácter característico de los primeros motores turbo). Para eliminarlo o reducirlo en todo lo posible se utilizan turbos de pequeño caudal que entran en funcionamiento a bajas vueltas y tienen la presión máxima limitada por una válvula de descarga. Otro sistema consiste en los turbocompresores de geometría variable que varía la incidencia de los gases de escape en la turbina en función del caudal."
SI,automotriz,,,Turbo-lag: Tiempo que transcurre desde que se acciona el acelerador hasta que la respuesta del turbo comienza a ser efectiva. Durante este tiempo los gases de escape tienen que vencer las inercias de la turbina para acelerar su giro y aumentar el caudal de aire fresco que entra al cilindro. Para reducir este tiempo se utilizan turbos de pequeño tamaño que necesitan poco caudal de gases de escape para funcionar y la masa de las turbinas es reducida. Tienen el inconveniente de tener un rendimiento limitado a caudal de su tamaño. Los turbocompresores más grandes permiten obtener potencias máximas más altas pero a costa de un comportamiento más brusco del motor. La solución ideal consiste en utilizar los turbocompresores de geometría variable.
SI,automotriz,,,"Turbulencia: Torbellino de aire que se utiliza para mejorar el reparto del combustible en la mezcla. La turbulencia consigue reducir el tamaño de las gotas de combustible, repartirlas de forma homogénea por toda la masa de aire y reducir el tiempo de combustión al mejorar la velocidad de propagación del frente de llama. El principal inconveniente de una turbulencia excesiva es la reducción de temperatura de la mezcla al estar renovándose continuamente el aire que está en contacto con las paredes de la cámara de combustión (que está más fría). Las turbulencias pueden crearse por medio de una determinada forma en el conducto de admisión (swirl) que son las más grandes o por medio de pequeños torbellinos que aparecen al dar una determinada forma a la cabeza del pistón o a la culata (squish)."
SI,automotriz,,,"Turismos compactos: Vehículos destinados a un uso preeminentemente familiar pero que poseen un tamaño contenido (en torno a cuatro metros). Sus potencias suelen oscilar entre los 75 y los 110 CV. Es el segmento preferido por los fabricantes para ser utilizados en las competiciones deportivas, por lo que entre todas las versiones ofrecidas suele haber una con un carácter deportivo muy marcado."
SI,automotriz,,,"Turismos utilitarios: Vehículos destinados a un uso preeminentemente urbano, por lo que suelen tener un tamaño contenido (3,7 metros) y son propulsados por motores de baja cilindrada en torno a los 75 CV. Se destina su uso a los clientes más jóvenes y a las familias como segundo coche."
SI,automotriz,,,"ULEV: Siglas de Ultra low-emission vehicle utilizadas por el organismo CARB para definir a la categoría de vehículos con emisiones muy bajas de partículas contaminantes (solamente pueden estar los vehículos dotados de motores híbridos o alimentados por pilas de combustible). No pueden superar unas emisiones por encima de 0,12 gr/km de óxidos de nitrógeno, 1,06 gr/km de monóxido de carbono y 0,025 gr/km de hidrocarburos y otros gases orgánicos."
SI,automotriz,,,ULSB: Siglas de Ultra Light Stell Body que es un proyecto en común llevado a cabo por la industria norteamericana del acero para desarrollar un acero de alta resistencia para ser aplicado en la construcción de carrocerías con perfiles variables en función de los esfuerzos que tenga que soportar. Pretenden ofrecer una alternativa a las carrocerías de aluminio que empiezan a ser utilizadas en algunos automóviles.
SI,automotriz,,,USABC: Siglas de United States Advanced Battery Consortium que es un organismo norteamericano creado para investigar la utilización de nuevos acumuladores de energía eléctrica para ser utilizados en los vehículos propulsados con motores eléctricos.
SI,automotriz,,,"Utilitarios: Definición utilizada para nombrar a los automóviles pequeños con un tamaño de 3,7 metros y con motorizaciones pequeñas destinados a un uso preeminentemente urbano. Sus potencias máximas no suelen superar los 75 CV."
SI,automotriz,,,"UTTO: Siglas de Universal Transmission Tractor Oil que se utiliza para definir a los lubricantes destinados a la maquinaria agrícola y de obras públicas. Pueden ser lubricantes de motor o de sistemas de transmisión, líquidos para los circuitos hidráulicos, o para los frenos bañados en aceite."
SI,automotriz,,,"Válvula: Pieza encargada de abrir y cerrar los conductos de entrada y salida de aire del cilindro. Consiste en una cabeza que se apoya en el asiento de la cámara de combustión y que por medio de un vástago se une al muelle que la mantiene cerrada y también la pone en contacto con la leva que la abre. Las válvulas son de admisión cuando se colocan el los conductos de entrada de aire y de escape cuando están en los conductos de salida de los gases quemados. Las válvulas se fabrican en acero, aunque algunos motores deportivos las tienen de titanio. Las válvulas de escape tienen que ser más robustas porque trabajan a una temperatura (800ºC) mucho mayor que las de admisión. El tamaño de las válvulas de escape es más reducido porque necesitan menos sección para la salida de los gases que están a un presión mayor que la atmosférica. La válvula de admisión necesita más tamaño porque los gases de la admisión llegan a la válvula con depresión, o una ligera presión en los motores sobrealimentados."
SI,automotriz,,,"Válvula de descarga: O también conocida con su nombre en ingles de waste-gate. Se coloca en los motores sobrealimentados entre el elemento compresor y los conductos de admisión. Evita que la presión en el colector de admisión pueda superar un determinado valor y dañar los componentes del motor. La válvula permite salir una parte del aire de la admisión cuando la presión supera su valor de tarado. En función del tipo de motor, la válvula puede estar tarada en torno a los 0,7 - 0,9 bares (elevada potencia máxima), o entre 0,2 y 0,5 para los motores turboalimentados de bajo soplado (buena respuesta al acelerador)."
SI,automotriz,,,"Válvula de expansión: Empleada en los equipos de aire acondicionado para forzar al refrigerante a pasar de estado líquido a gaseoso. El gas, para poder mantenerse en este estado, recoge el calor del ambiente que lo rodea (el aire que entra al interior del vehículo). La válvula se coloca a la entrada del evaporador y se controla su funcionamiento por temperatura. El control de la válvula se suele hacer por la dilatación de un gas almacenado dentro de un bulbo en contacto con la superficie exterior del evaporador. En función de la temperatura, se amplia o se reduce el orificio de paso del refrigerante. La válvula divide las zonas de baja y de alta presión en los equipos de aire acondicionado."
SI,automotriz,,,Valvula de mariposa: Placa de metal que pivotea en un eje que controla el flujo de aire y la mezcla de aire combustible a un carburador o unidad de medición en un sistema de inyección de combustible.
SI,automotriz,,,VANOS: Siglas de Variable Nockenwellen Steuerung que es un sistema de distribución variable empleado por BMW. Consiste en desplazar el calado del árbol de levas utilizando la presión del aceite del sistema de engrase. El sistema aumenta el cruce de válvulas cuando el motor gira a altas revoluciones.
SI,automotriz,,,"Variador continuo: También denominados cambios de variador continuo CVT (Continuous Variable Transmision). Consisten en una caja de transmisión formada por dos poleas de diámetro variable y unidas por una correa trapezoidal. En función de los diámetros de las correas se puede establecer diferentes relaciones de cambio. En las relaciones de transmisión cortas, la polea conductora tiene un diámetro pequeño, mientras que la polea conducida tiene un diámetro grande. En las marchas largas, la polea conductora aumenta su diámetro mientras que la polea conducida tiene que reducirlo. Hay que tener en cuenta que la longitud de la correa no varía, por lo que una variación en el diámetro de una correa tiene que ser compensado con una variación en el diámetro de la otra polea. Este sistema tiene infinidad de velocidades que permiten adaptar el comportamiento del motor a cada condición de funcionamiento, aunque algunos fabricantes limitan este sistema de cambio a seis o siete relaciones prefijadas (repitiendo las mismas posiciones de las poleas). El accionamiento de las poleas suele ser hidráulico a través de un sistema electrónico de control."
SI,automotriz,,,"Variador de fase: Sistema que permite modificar el momento de apertura de las válvulas al modificar el calado de un árbol de levas con respecto a la posición del cigüeñal. Consiste en un mecanismo colocado entre el piñón de accionamiento y el árbol de levas. El mecanismo no actúa a regímenes medios y lo hace en altos. En ese momento, se modifica unos determinados grados el anclaje del árbol de levas con respecto a su piñón de arrastre y el momento de apertura de la válvulas se modifica. Este tipo de sistema suele utilizar un mecanismo actuador controlado por la presión de aceite en el sistema de engrase."
SI,automotriz,,,"VDA: Acrónimo de ""Verband der Automobilindustrie"". Asociación de fabricantes alemanes, cuyo fin es ""promocionar los intereses de la industria del automóvil alamena en todos los campos del sector del transporte"" (sic)."
SI,automotriz,,,"Velocidad media del pistón: El pistón en su recorrido alternativo se desplaza dos carreras por cada vuelta del cigüeñal. Este desplazamiento se realiza con aceleraciones y velocidades variables. La mayor velocidad corresponde cuando el pistón está en la mitad de la carrera, mientras que los puntos de menor velocidad (igual a cero) se encuentran en los extremos de la carrera (puntos muertos). La media de todas las velocidades instantáneas del pistón permite obtener la velocidad media. Este dato es importante para determinar las fuerzas de inercia que llegan al pistón cuando el motor está girando a máxima potencia o al límite de las revoluciones. En los motores empleados en turismos la velocidad media suele oscilar entre 10 y 15 m/s."
SI,automotriz,,,"Viscosidad: En relación a los lubricantes, es la propiedad que mide la resistencia que pone el aceite para fluir. Está en función de la temperatura, siendo mayor cuando la temperatura baja y menor cuando la temperatura aumenta. El mejor comportamiento de un aceite se consigue cuando su densidad apenas varía con la temperatura. Esta propiedad se mide según la norma ASTM-D-445 y los resultados se indican en centistokes a 40 ºC ó a 100 ºC."
SI,automotriz,,,"Volante motor: Pieza utilizada en los motores para almacenar energía cinética. Se coloca en un extremo del cigüeñal y sirve de apoyo al embrague. Tiene una gran masa y su funcionamiento consiste en recoger parte de la energía que se produce durante la carrera de expansión para cederla posteriormente en las demás carreras del pistón donde no se produce trabajo. El volante motor o de inercia suaviza el funcionamiento del motor, aumentando la masa en movimiento lo que favorece la entrega de par. Su masa depende del número de cilindros, siendo más pequeño cuantos más cilindros tiene el motor (la energía la aportan las carreras de expansión de los otros cilindros). Su principal inconveniente es el freno que opone al motor para conseguir rápidas aceleraciones."
