NARCISISTA,RASGO_1,RASGO_2,RASGO_3,COMENTARIOS
SI,automotriz,,,"Motor rotativo: Conocido como motor Wankel que fue su inventor en 1954. Este tipo de motor es de combustión interna pero rotativo, en vez de alternativo. Su funcionamiento se basa en el giro de un rótor de tres lados iguales ligeramente convexos. El rotor está alojado en el interior de una carcasa especial con tres cámaras diferentes. El rotor gira por medio de un sistema excéntrico sobre un eje que se encarga de recoger la fuerza de las explosiones. El volumen entre el rótor y las cámaras va variando conforme gira. Una de las cámaras se utiliza para la admisión mientras el volumen entre un lado del rotor y la carcasa aumenta. Luego se deja la cámara de admisión mientas el volumen se reduce y se comprime la mezcla. En la siguiente cámara se termina la compresión y se produce el salto de la chispa, la combustión y la expansión de los gases. El rotor sigue girando y llega hasta la cámara destinada al escape por donde salen los gases quemados. Todo este ciclo se va realizando también de forma simultánea en los otros dos lados del rótor. Este tipo de motor presenta varios problemas, el primero proviene del equilibrado que se soluciona con dos rotores desfasados 180º. Pero el mayor problema viene de la falta de estanqueidad entre el rótor y la carcasa. Los segmentos utilizados tienen una duración muy corta por el gran rozamiento y altas presiones que soportan. Las ventaja que aporta es el reducido peso en relación a la potencia que se obtiene. Mazda es actualmente el único fabricante que ofrece este tipo de motores que los completa con la sobrealimentación."
SI,automotriz,,,"Motricidad: Se conoce como motricidad a la capacidad que presenta un vehículo para transmitir la potencia al suelo. La motricidad de un vehículo depende de la adherencia disponible entre el neumático y el suelo y del diseño y puesta a punto de las suspensiones. La alineación de las ruedas, el estado de los neumáticos, la eficacia de los amortiguadores y las transferencias de masa del vehículo por las aceleraciones longitudinales y transversales también inciden en la motricidad."
SI,automotriz,,,MSR: Denominación utilizada en un sistema que evita la pérdida de adherencia de un neumático con el suelo a causa de un excesivo par resistente del motor al realizar una fuerte reducción. Una centralita electrónica detecta esta situación a través de los sensores de las ruedas del sistema antibloqueo y envía una señal a la centralita de gestión del motor para que eleve el régimen de giro del motor y se reduzca el par resistente hasta que las ruedas recuperen la adherencia.
SI,automotriz,,,Multigrado: Denominación utilizada en los aceites que mantienen su índice de viscosidad aunque se produzcan grandes variaciones en su temperatura de funcionamiento. Según su capacidad puede abarcar más o menos escalas de viscosidad. Se clasifican según sus límites de viscosidad mínimo y máximo a través de las escalas SAE. Un aceite multigrado 20W40 indica que se comporta como un SAE 20 a bajas temperaturas y como un SAE 40 a altas temperaturas.
SI,automotriz,,,Multitronic: Lo utiliza Audi en los coches equipados con caja de cambios automática de varia dor continuo. Nissan lo llama Hypertronic. También puede apare cer bajo las siglas CVT y ECTV.
SI,automotriz,,,"Multiválvulas: Denominación utilizada en los motores provistos de un número de válvulas por cilindro mayor que dos, normalmente suelen ser cuatro, pero hay vehículos con tres válvulas por cilindro y otros con cinco (con patente de Yamaha). Estos motores aportan la ventaja de una mayor sección de paso del aire que entra y sale del cilindro, mejorando el llenado a altas vueltas. El inconveniente es que necesitan aceites con mejores prestaciones para soportar los mayores esfuerzos que proviene del aumento de la potencia y del sistema de distribución. Los aceites destinados a estos motores suelen ser más fluidos pero sin llegar a afectar al desgaste entre las piezas."
SI,automotriz,,,NASCAR: Siglas de National Association for Stock Car Auto Racing que es el organismo de EE.UU. encargado de reglamentar las competiciones deportivas de turismos y vehículos derivados de coches de producción.
SI,automotriz,,,NATS: Sistema antirrobo con inmovilizador electrónico del motor de Nissan. Para Ford es PATS.
SI,automotriz,,,NCAP: Siglas de European New Car Assessment Progman que es un organismo creado para controlar y normaliza un tipo de test de choque utilizado en la Unión Europea.
SI,automotriz,,,"Neumáticos lisos: Conocidos también con el nombre inglés de slick. Se trata de neumáticos para usar en asfalto seco y que carecen de canales para evacuar el agua. De esta forma disponen de mayor superficie de contacto con el suelo a la vez que aumenta la rigidez de la banda de rodadura al no ser cortada por los canales de evacuación. Se emplean solamente en competición y el compuesto de su banda de rodadura puede variar en sus características. Se consigue neumáticos más duros para aguantar mejor las altas temperaturas y aumentar su duración. O neumáticos más blandos para mejorar el agarre al suelo con bajas temperaturas a costa de una menor duración. En neumáticos de calle, la pérdida del dibujo supone también la pérdida de la goma con mayor adherencia, resultando una situación de alto riesgo."
SI,automotriz,,,NHTSA: Siglas de National Highway Safety Administration que es un organismo de EE.UU. que se dedica al control de la seguridad del tráfico en carretera y que actúa en todos los estados. Depende directamente del Departamento de Transportes y se encarga a verificar la aplicación de las reglamentaciones de seguridad vial.
SI,automotriz,,,"Normas ACEA: Normas de la Asociación de Constructores Europeos de Automóviles. Es un organismo creado para controlar entre otras cosas los niveles de calidad de los lubricantes utilizados en los automóviles europeos. Esta nueva clasificación reemplaza a la antigua CCMC que corresponde la A con los motores ligeros de gasolina, la B para los motores Diesel ligeros y E para los motores Diesel pesados."
SI,automotriz,,,"Normas API: Normas del American Petroleum Institute. Se utilizan para determinar los niveles de calidad exigidos a los lubricantes destinados a los motores de automóviles norteamericanos. La clasificación se realiza por dos letras, la primera indica si el motor es gasolina (S) o Diesel (C). La segunda letra indica el nivel alcanzado por orden creciente según el abecedario."
SI,automotriz,,,Número de bastidor: Número único que dispone cada vehículo y que lo identifica de forma inequívoca. Se utiliza tanto por el fabricante como por los organismos oficiales para efectos legales.
SI,automotriz,,,Número de cetano: Utilizado en los combustibles para clasificarlos según su temperatura de inflamación. El número se obtiene de comparar el punto de inflamación de un combustible con el punto de inflamación de una mezcla con un porcentaje de cetano y de alfa-metilnaftalina. Un combustible con número de cetano 95 indica que su inflamación se produce en el mismo punto que una mezcla de 95 partes de cetano por 5 de alfa-metilnaftalina. Cuanto mayor sea el número de cetano más alto es el momento de inflamación del combustible y más se puede subir la relación de compresión.
SI,automotriz,,,Número de octano: Utilizado en los combustibles para clasificarlos según su temperatura de inflamación. El número se obtiene de comparar el punto de inflamación de un combustible con el punto de inflamación de una mezcla con un porcentaje de isoctano y de eptano. Un combustible con número de octano 98 indica que su inflamación se produce en el mismo punto que una mezcla de 98 partes de isoctano por 5 de eptano. Cuanto mayor sea el número de octano más alto es el momento de inflamación del combustible y más se puede subir la relación de compresión.
SI,automotriz,,,"NVCS: Siglas de Nissan Valve Timing Control System, que es el nombre que Nissan utiliza en sus sistemas de distribución variable."
SI,automotriz,,,"Orden de encendido: Secuencia utilizada para establecer el momento de realizar la combustión en los cilindros de un motor. Este orden se establece de forma que la fuerza que tiene que soportar el cigüeñal se realice de la forma más homogénea posible. Evitando en todo lo posible que las combustiones se produzcan en cilindros adyacentes, o que puedan aparecer interferencias entre las fases de admisión o escape de varios cilindros. Según el número de cilindros y la disposición adoptada en el motor se utiliza un determinado orden de encendido."
SI,automotriz,,,"O'ring: Denominación que recibe la unión entre dos conductos a través de una conexión con una junta tórica. Consiste en un cilindro hueco donde se introduce otro cilindro pero con diámetro exterior más pequeño. Entre los dos elementos y para evitar fugas se coloca una junta tórica, que es un anillo de goma que se deforma para adaptarse al espacio que queda entre las dos piezas de la unión. Se suele utilizar en la mayor parte de las uniones entre los elementos de los equipos de aire acondicionado. Se recomienda emplear juntas tóricas nuevas cada vez que se desmonta y se monta una unión de este tipo."
SI,automotriz,,,Overboost: Denominación que recibe un aumento de la presión de soplado del turbocompresor durante un breve espacio de tiempo. Se utiliza para aumentar la potencia del motor durante fuertes aceleraciones. Se consigue actuando sobre la válvula de regulación de presión en la admisión de los motores sobrealimentados.
SI,automotriz,,,Overdrive: Denominación que recibe un dispositivo colocado a la salida de la caja de cambios y que conseguía una relación de cambio muy larga. El sistema consiste en un nuevo tren de engranajes que se utilizaba en los vehículos norteamericanos para poder circular en carretera con el motor muy bajo de vueltas. Este sistema se dejo de emplear cuando los vehículos incorporaron la caja de cambios de cinco velocidades.
SI,automotriz,,,Par específico: Relación existente entre el par máximo que desarrolla un motor y su cilindrada. Se indica como el par que desarrolla ese motor por cada litro de cilindrada. El mayor par específico corresponde a los motores turbodiesel de gran cilindrada.
SI,automotriz,,,"Par motor: Es la capacidad de un motor para realizar un trabajo. El par indica la fuerza a una determinada distancia que se puede obtener a la salida del cigüeñal de un motor. El par máximo se produce cuando el llenado del cilindro es óptimo, obteniéndose el mayor rendimiento del combustible que se introduce al motor. El par máximo se mide en Newton por metro (sistema internacional) aunque también está muy difundido los kilopondios por metro. Lo que significa que un motor con 220 Nm puede desarrollar una fuerza de 220 Newton aplicada a una distancia de un metro desde el centro del cigüeñal. La curva de par se obtiene de representar gráficamente el par motor instantáneo en cada número de revoluciones."
SI,automotriz,,,Paralelogramo deformable: Tipo de suspensión utilizado en los vehículos más deportivos. Consiste en sujetar el buje de la rueda a través de dos triangulaciones paralelas y superpuestas. Una colocada entre la parte baja del buje y la carrocería y otra colocada entre la parte superior del buje y la carrocería. El conjunto forma un paralelogramo de cuatro lados fijos pero que puede variar el ángulo entre ellos. El resorte y el amortiguador se suelen colocar en diagonal entre el buje y la carrocería. Tiene la ventaja que mantiene la superficie de rodadura de la rueda siempre paralela al suelo. Pero necesita más espacio y su fabricación y colocación más costosa.
SI,automotriz,,,"PDC: Siglas de Park Distance Control que es la denominación de los sistemas de ayuda al conductor cuando se realizan maniobras de aparcamiento. Utilizan sensores en los paragolpes que detectan la proximidad de obstáculos e informan al conductor por medio de señales acústicas de su proximidad. Cuanto más cerca está el obstáculo, mayor es la frecuencia del sonido emitido."
SI,automotriz,,,Periodo: Tiempo necesario para que se produzca un ciclo completo. Se mide en segundos. Es la inversa de la frecuencia (número de ciclos por segundo). El periodo es el tiempo necesario para que el cigüeñal complete una vuelta.
SI,automotriz,,,"Petróleo: Mezcla de hidrocarburos (hidrógeno y carbono) que se obtiene de la naturaleza y que luego es refinado para la obtención de combustibles, lubricantes y materias primas para la fabricación de plásticos y otros compuestos. El proceso de refinado se realiza por medio de una destilación fraccionada y consiste en calentar el petróleo en una columna de fraccionamiento y que a diferentes alturas salen los productos al condensarse a una determinada temperatura."
SI,automotriz,,,Pick up: Denominación utilizada en los vehículos que disponen de habitáculo para los pasajeros y de zona de carga descubierta. El número de asientos en la cabina puede variar desde dos hasta cinco. Su tamaño se encuentre entre los cuatro metros y medio y los seis metros. Está destinado casi exclusivamente al mercado de EE.UU. aunque empieza a tener aceptación en Europa. Se conoce también con esta denominación al sensor utilizado en las motocicletas para informar a la centralita del encendido del momento ideal de saltar la chispa en la bujía.
SI,automotriz,,,"Pila de combustible: A juzgar por los proyectos de desarrollo de la mayoría de los grandes fabricantes de automóviles, parece que los vehículos dotados de pilas de combustible serán una realidad en muy poco tiempo. Se trata de acoplar al vehículo una especie de central química en miniatura en la que se desarrolla un proceso de electrólisis inversa, es decir, se hace reaccionar oxígeno e hidrógeno para producir la electricidad necesaria para alimentar un motor eléctrico, eliminando así el problema actual de los coches eléctricos, que es el de la escasa autonomía de sus baterías. El oxígeno necesario para la reacción se toma directamente del aire, mientras que el hidrógeno se puede suministrar puro, o bien obtenerlo de la combustión de gasolina o metanol, que produce hidrógeno y otros subproductos fáciles de tratar en catalizadores especiales. Se encuentran en fase de desarrollo. Se trata de reducir el tamaño (todavía ocupan mucho espacio) y bajar las temperaturas de funcionamiento, que están por encima de los 100 grados."
SI,automotriz,,,"Pistón: Elemento móvil del motor de explosión alternativo que se encarga de comprimir la mezcla, cerrar la cámara de combustión por la parte inferior y de recoger la energía desarrollada durante la expansión de los gases quemados. Se conecta al cigüeñal a través del bulón y de la biela. En su periferia dispone de varios segmentos que se encargan de mantener la cámara de combustión estanca con el cilindro. El pistón trabaja a altas temperaturas al estar en contacto con los gases quemados y necesita ser refrigerado, normalmente a través del aceite del sistema de lubricación. En los motores de dos tiempo se refrigera en parte con los gases frescos que viene de la admisión. Se fabrican en aleaciones de aluminio y luego se mecanizan para conseguir un peso y unas dimensiones muy ajustadas. En los motores de competición se fabrican de almunia forjado que consigue reducir el peso para un misma resistencia mecánica. El pistón se divide en la cabeza y la falda. La cabeza es la parte superior y la falda se encarga de alojar al bulón y guiar al pistón en su recorrido por dentro del cilindro."
SI,automotriz,,,"Plataforma: Es la parte baja de la carrocería que sirve de estructura a todo el vehículo. En la plataforma quedan sujetos las bancadas de la suspensión, el motor, la transmisión y dirección, principalmente. Una misma plataforma puede ser utilizada por varios modelos de esta forma, una vez puesto a punto el comportamiento de una plataforma, el coste se reparte para muchos más vehículos. Lo mismo sucede con las piezas utilizadas, es lo que se llama economía de escala. El grupo Volkswagen utiliza sus plataformas en las diferentes marcas que tiene. La plataforma pequeña se utiliza en el Polo, Ibiza y Córdoba (que será renovada con la utilizada por el Fabia). La plataforma mediana la utiliza la utilizan el Leon, Toledo, Octavia, A3, Golf, Bora. La plataforma mayor es la mediana ligeramente alargada y es empleada por el A4 y Passat. La carrocería que sigue a la plataforma es modificada para diferenciar claramente los diferentes vehículos."
SI,automotriz,,,Portón: Nombre de la pieza que cierra la parte trasera de los vehículos de dos volúmenes o sin maletero diferenciado. Esta pieza contiene la luna trasera y báscula en la parte trasera del techo.
SI,automotriz,,,"Post-inyección: Inyección de combustible en los motores Diesel que se realiza en los motores con retraso al punto muerto superior del pistón. Esta inyección aporta un combustible que no puede quemarse en el interior del cilindro por falta de tiempo y de oxígeno cerca. El combustible se quema durante la fase de escape, elevando considerablemente la temperatura de estos gases durante su salida a la atmósfera. Este tipo de inyección se emplea para elevar la temperatura de funcionamiento de catalizador y facilitar su regeneración. Solamente los nuevos sistema de inyección Diesel de conducto único dotados de catalizador regenerativo pueden utilizar este sistema. La post-inyección solamente actúa durante un tiempo para mantener el buen estado del catalizador, fuera de esta función no actúa."
SI,automotriz,,,Potencia: Cantidad de trabajo realizada en una unidad de tiempo. La potencia de un motor se mide en caballos de vapor (CV) o en kilovatios (Kw) en el sistema internacional. Se obtiene de multiplicar el par motor por el número de revoluciones y ajustar las unidades. La potencia máxima se obtiene a un régimen superior que el par máximo. Se compensa el peor llenado del cilindro con una mayor cantidad de explosiones por minuto.
SI,automotriz,,,"Potencia específica: Es la relación entre la potencia máxima obtenida de un motor y su cilindrada. Se utiliza para comparar el rendimiento en los motores con diferente cilindrada. La mayor potencia específica se obtiene de los motores de pequeña cilindrada que pueden girar muy altos de vueltas. Entre los automóviles se ha llegado hasta los 100 CV y los 120 CV por litro, mientras que en motocicletas se rozan los 200 CV/litro para lo motores de cuatro tiempos y los 260 CV/litro para los motores de dos tiempos."
SI,automotriz,,,"Potenciómetro: Elemento eléctrico que permite variar su resistencia al paso de la corriente eléctrica en función de la posición del cursor. Este elemento se utiliza para informar a las centralitas electrónicas de la posición de elementos que pueden moverse. Se suele emplear para detectar la posición del acelerador, de la mariposa, del dosificador de combustible (bombas Diesel), de la apertura de válvulas, etc."
SI,automotriz,,,"Pre-encendido: Nombre que recibe la inflamación de la mezcla en la cámara de combustión antes que se produzca el salto de la chispa en la bujía. El pre-encendido está causado por puntos calientes en la cámara de combustión por acumulación de carbonilla en rincones o en la cabeza del pistón. También puede estar causado por una bujía que trabaje demasiado caliente (grado térmico inadecuado). Esta situación puede originar un rápido deterioro del motor al crearse contrapresiones sobre la cabeza del pistón antes de alcanzar el punto muerto superior al quemarse el combustible. Se puede detectar fácilmente al quitar el contacto y notar que el motor no se detiene inmediatamente, sino que gira unas pocas vueltas más."
SI,automotriz,,,"Pre-mezcla: En los motores de dos tiempos se tiene que introducir aceite al cárter a través del sistema de admisión. El sistema de pre-mezcla consiste en añadir el aceite al combustible en la proporción adecuada para que luego entre al motor a través de la mezcla realizada en el carburador. Este sistema ha dejado de utilizarse en las motocicletas de dos tiempos y solamente se utiliza en pequeña maquinaria agrícola (cortacésped, sierras, etc.) o en motocicletas de dos tiempos destinadas a competición."
SI,automotriz,,,Pre-mix: Denominación utilizada para hacer referencia a los sistemas de Pre-mezcla.
SI,automotriz,,,"Presión media efectiva (p.m.e.): Es la media de todas las presiones instantáneas que se producen en la fase de combustión y expansión de los gases dentro del cilindro. La presión media está en función del llenado del cilindro y del aprovechamiento del combustible que se introduce al motor. La fuerza obtenida en cada cilindro se obtiene multiplicando la presión media por la superficie de la cabeza del pistón, y junto con la palanca de las muñequillas del cigüeñal determinan el par motor. La presión media se mide en kilopondios por centímetro cuadrando o en Newton por metro cuadrado (sistema internacional)."
SI,automotriz,,,Presostato: Interruptor eléctrico accionado mediante presión. Se emplean para encender el testigo de presión de aceite cuando no alcanza un determinado valor. También se emplean en los equipos de aire acondicionado para controlar el accionamiento del compresor en función de las presiones en el circuito del refrigerante. De esta forma no permite el accionamiento del compresor cuando la presión es muy baja (falta de refrigerante) o muy alta (exceso de refrigerante o filtro obstruido).
SI,automotriz,,,"Prestaciones: Denominación que normalmente se utiliza para hacer mención de las cualidades que posee un vehículo ante la aceleración, frenada , velocidad máxima, etc."
SI,automotriz,,,Proteger contra la corrosión: En relación a los lubricantes es la acción de mantener las piezas del interior del motor en contacto con el aceite sin ataques de los elementos originados durante la combustión.
SI,automotriz,,,PRS: Sistema de pedales retráctiles de Opel. Los pedales del freno y del embrague se desen ganchan automáticamente a un nivel de impacto predeterminado para proteger de daños los pies y la parte baja de las piernas del conductor en caso de colisión.
SI,automotriz,,,"Prueba de choque (Crash-test): Test o ensayos destructivos que se realizan sobre un vehículo para comprobar que su estructura es capaz de resistir un determinado impacto. Estas pruebas pueden ser de carácter obligatorio (para homologar un vehículo ante los organismos oficiales) o voluntarias (para mejorar la seguridad de un vehículo por encima de los requerimientos de las normas). Se realizan impactando un vehículo y un objeto, aunque algunos fabricantes realizan choques entre vehículos. También se realizan pruebas de impactos laterales y de vuelcos. Durante el choque se utilizan multitud de sensores y cámaras para poder realizar un estudio del comportamiento de la estructura del vehículo y de los ocupantes del mismo. Luego se comprueba las posibles lesiones de los ocupantes, la resistencia de la estructura ante el golpe, la apertura de las puertas y la inclusión de objetos en el habitáculo (dirección, pedales, motor, transmisión) entre otros."
SI,automotriz,,,Punta-tacón: Expresión utilizada para nombrar el accionamiento del acelerador y del freno con el mismo pie. Se realiza para dar un golpe de gas cuando se reducen marchas o para mantener el motor traccionando mientras se reduce ligeramente la velocidad con el freno. Se puede realizar con la punta del pie sobre los dos pedales o con la punta del pie sobre uno de ellos y el tacón sobre el otro. Es una técnica que exige gran destreza al conductor y que no es recomendable utilizar en conducción abierta (no hace falta cambiar tan deprisa) y los pedales están diseñados de otra forma.
SI,automotriz,,,Punto de combustión: En relación a los lubricantes indica la temperatura (por encima del punto de inflamación) a la que el aceite continúa ardiendo por lo menos durante cinco segundos. La prueba se realiza según la norma ASTM-D-92.
SI,automotriz,,,"Punto de congelación: En relación a los lubricantes es la mínima temperatura a la que un aceite mantiene todavía sus propiedades de fluidez. Para mejorar el arranque en frío, este punto tendría que ser lo más bajo posible. La prueba se realiza según la norma ASTM-D-97."
SI,automotriz,,,"Punto de inflamación: En relación a los lubricantes es la temperatura hasta la que se puede calentar un aceite sin peligro que puede inflamarse (aparición de un fogonazo) en presencia de una llama libre. La prueba se realiza según la norma ASTM-D-92, cuando se hace en recipiente abierto."
SI,automotriz,,,"Punto muerto inferior (PMI): Situación que alcanza el pistón cuando cambia de sentido descendente a sentido ascendente en su dirección. En ese momento la velocidad del pistón es cero, y el volumen del cilindro máximo. En este punto el pistón está en la parte más baja de su recorrido. En un ciclo completo de un motor de cuatro tiempos se alcanzan dos puntos muertos inferiores. Uno al finalizar la fase de admisión y el otro cuando finaliza la fase e expansión."
SI,automotriz,,,"Punto muerto superior (PMS): Situación que alcanza el pistón cuando cambia de sentido ascendente a sentido descendente en su dirección . En ese momento la velocidad del pistón es cero, y el volumen del cilindro mínimo. En este punto el pistón está en la parte más alta de su recorrido. En un ciclo completo de un motor de cuatro tiempos se alcanzan dos puntos muertos"
SI,automotriz,,,superiores. Uno al finalizar la fase de compresión y el otro al finalizar la fase de escape.
