NARCISISTA,RASGO_1,RASGO_2,RASGO_3,COMENTARIOS
SI,automotriz,,,"Detonación: Proceso por el cual la mezcla alojada en la cámara de combustión no se quema sino que explosiona de forma espontánea. Se produce al saltar la chispa y quemar la mezcla que está cerca de los electrodos, el aumento de la temperatura y de la presión en la cámara de combustión hace llegar o la mezcla que se encuentra en otros puntos de la cámara de combustión a su punto de inflamación y explosionar. Se detecta por el ruido a golpeteo metálico que se produce en la zona alta del motor. La detonación aparece a causa de un excesivo calentamiento de la mezcla por depósitos de carbonilla en la culata, número de octanaje del combustible demasiado bajo, encendido muy adelantado, una relación de compresión muy alta o una temperatura muy alta de los gases en la admisión. Para evitar la detonación se tiene que limpiar la cámara de combustión de carbonilla, reducir el avance del encendido, aumentar el octanaje del combustible o reducir la temperatura de los gases aspirados."
SI,automotriz,,,"Diámetro: Medición que indica la distancia de una recta que para por el centro de un círculo y lo divide en dos partes iguales. En un motor se utiliza para calcular la cilindrada. El diámetro permite conocer la superficie del pistón. El volumen de cada cilindro se obtiene multiplicando esa superficie por la altura (carrera). Hay que prestar atención a las unidades, ya que el diámetro se suele expresar en milímetros, pero la cilindrada se indica en centímetros cúbicos."
SI,automotriz,,,"Diferencial: Sistema mecánico que permite compensar las diferencias de giro en las dos ruedas motrices de un mismo eje. El sistema de transmisión se acopla al piñón del diferencial que se une a la caja de satélites a través de una corona dentada. La caja de satélites contiene en su interior a los planetarios (piñones que giran solidarios con los palieres de las ruedas) y los satélites (piñones que engranan con los planetarios pero que son arrastrados por la caja). Cuando el vehículo se desplaza en línea recta, la caja de satélites arrastra a los planetarios a través de los satélites y las dos ruedas giran con las mismas revoluciones. En una curva, la rueda del interior tiende a frenarse mientras que la rueda del exterior se acelera. Los satélites giran sobre su eje y permiten reducir las revoluciones de un palier y aumentar las del otro. De esta forma se compensa los diferentes recorridos de las ruedas al trazar una curva. El inconveniente que tiene es que si una rueda pierde tracción, todo el giro de la transmisión se realiza sobre dicha rueda, ya que no ofrece resistencia. Para evitar esta situación es necesario proceder al bloqueo del diferencial o utilizar diferenciales autoblocantes."
SI,automotriz,,,"Diferencial bloqueable o controlado: Diferencial que puede anular su capacidad de permitir la diferencia de giro entre ruedas. Se utiliza en los vehículos con tracción total, en todoterrenos, en vehículos industriales y agrícolas. Su funcionamiento se basa en anular el giro de los satélites al bloquear uno de los palieres con la caja de satélites. Todo el conjunto gira solidario y las ruedas también. Se consigue un tarado del 100%. Este tipo de bloqueo solamente puede utilizarse a bajas velocidades y en terreno con poca adherencia. En caso contrario la transmisión se resiente pudiendo incluso llegar a la rotura de algún palier. El accionamiento del bloqueo puede ser mecánico, eléctrico e incluso neumático."
SI,automotriz,,,Diferencial Torsen: Tipo de diferencial autoblocante que transmite mayor par motor a la rueda que presente mayor adherencia.
SI,automotriz,,,Diferencial Viscoso: Diferencial autoblocante que cambia su mecánica de engranajes por líquido hidráulico y discos.
SI,automotriz,,,DIN: Siglas de Deutsche Institut für Normung que es el Instituto Alemán de Normalización.
SI,automotriz,,,Dinamo: Generador de energía eléctrica que se utilizaba anteriormente y que fue sustituido por el alternador. La dinamo resulta de emplear de forma inversa un motor eléctrico. La corriente que se obtiene es continua pero necesita un mayor valor de rotación para generarla en comparación con el alternador.
SI,automotriz,,,"Dirección asistida: El sistema está formado por una bomba hidráulica que utiliza la fuerza del motor para impulsar el aceite por el circuito hidráulico. La bomba recoge el aceite de un depósito y lo envía a la columna de la dirección donde se encuentra la válvula de control. De la válvula salen dos conductos para llevar el aceite hasta el cilindro. La válvula dispone de otro conducto de salida para que el aceite pueda retornar al depósito. El cilindro está dividido en dos cámaras por medio de un pistón móvil que se desplaza en su interior y que está unido al sistema mecánico de la dirección. El cilindro puede estar colocado en el interior del conjunto de la dirección o en la parte exterior, según el modelo de vehículo."
SI,automotriz,,,Dispersancia: Propiedad que tiene el aceite para evitar que las impurezas indisolubles procedentes de la combustión se acumulen formando partículas más grandes. Se evita que taponen los poros del filtro o dañen las paredes de las piezas lubricadas.
SI,automotriz,,,"Dispersante: Sustancia que se añade al aceite para aumentar su capacidad de dispersancia, es decir, que las impurezas indisolubles no se agrupen formando partículas más grandes."
SI,automotriz,,,Distancia de confort: Longitud entre el pedal de freno y el respaldo del asiento trasero. Se utiliza para medir el espacio habitable de un vehículo.
SI,automotriz,,,"Distribución: Sistema encargado de controlar el flujo de aire que tiene que entrar y salir del cilindro en un motor de cuatro tiempos. Está formado por las válvulas, los taqués, los muelles, el árbol de levas y la conexión mecánica con el cigüeñal que puede ser por correa dentada o por cadena. El sistema de distribución necesita un reglaje para compensar las dilataciones que sufren las válvulas por efecto de su alta temperatura de trabajo. Este reglaje puede ser por medio de tuerca y tornillo, pastillas calibradas o de forma automática a través de taqués hidráulicos. Las válvulas abren o cierran los conductos de admisión y escape al ser presionadas por el árbol de levas. El retroceso de las válvulas se encarga generalmente a un muelle, aunque hay sistemas que retornan por presión de aire y otros por el efecto de otra leva llamada de cierre."
SI,automotriz,,,"Distribución desmodrómica: Denominación que utiliza Ducati en su sistema de accionamiento de las válvulas, Los árboles de levas disponen de dos levas para cada válvula, una se encarga de abrirla, mientras que otra la cierra. No existe muelle para el retorno de las válvulas. La leva que abre la empuja desde arriba como el sistema convencional, mientras que la leva que cierra levanta a al válvula haciendo palanca con una horquilla. Este sistema se utiliza para evitar la flotación que se produce en las válvulas cuando el motor gira alto de vueltas. Esta flotación se produce cuando la válvula cierra muy rápido y el choque con el asiento la vuelve a abrir, pudiendo llegar a tocar con el pistón. Este sistema permite girar a los motores de gran cilindrada unitaria altos de vueltas aunque las válvulas sean grandes y por tanto, pesadas. El inconveniente de este sistema es su mayor complejidad técnica en su construcción y reglaje."
SI,automotriz,,,"Distribución variable: Sistema que permite modificar los ángulos de apertura de las válvulas para aumentar el tiempo de llenado y vaciado del cilindro cuando el motor gira alto de vueltas y el tiempo disponible para ello es menor. Estos sistemas permiten utilizar el tiempo óptimo de apertura y cierre de las válvulas a cualquier régimen de giro del motor. Según el fabricante del sistema se utilizan diferentes soluciones que modifican el calado de los árboles de levas, hacen actuar otra leva a altas revoluciones o modifican por medio de excéntricas la posición del árbol de levas sobre sus apoyos. Según el sistema se modifica el momento de apertura, la alzada de la válvula e incluso el tiempo que permanece abierta."
SI,automotriz,,,Distribuidor: Elemento del sistema de encendido activado por el árbol le levas que tiene como misión realizar el corte eléctrico que generará la alta tensión en la bobina y distribuir esta alta tensión a la correspondiente bujía de cada cilindro mediante una pipa alojada en su eje y la tapa del distribuidor.
SI,automotriz,,,Divergencia: Ajuste en la geometría de la dirección que mide el ángulo que hay entre las ruedas delanteras. La divergencia de las ruedas se produce cuando la parte delantera de las mismas está más separada que la trasera. En caso contrario se llama convergencia. La divergencia se utiliza según la tendencia de la dirección a abrirse en función de las fuerzas producidas durante las aceleraciones y las frenadas.
SI,automotriz,,,"Doble embrague: Técnica utilizada en los cambios de marcha con dientes rectos (sin sincronizadores) para igualar las revoluciones del eje primario y del secundario del cambio y evitar golpes bruscos entre los engranajes que se acoplan. Consiste en pasar de una marcha a otra dejando primero el cambio en punto muerto y soltando el embrague, entonces se acelera el motor ligeramente para acto seguido proceder a insertar la marcha deseada. Esta operación es imprescindible cuando se reducen marchas, en caso contrario se producen rascados y chasquidos entre los piñones, reduciendo considerablemente la duración de la caja de cambios."
SI,automotriz,,,DOHC: Siglas e Double Over Head Camshaft que indica que un motor dispone de una distribución con doble árbol de levas en la culata. Uno actúa sobre las válvulas de admisión y otro sobre las válvulas de escape. Esta configuración se utiliza en los motores dotados de cuatro válvulas por cilindro.
SI,automotriz,,,Dosificación: Relación entre los elementos de una mezcla. La dosificación correcta se consigue cuando las proporciones de los elementos son las adecuadas. En el caso del aire y el combustible se consigue una dosificación correcta cuando todo el combustible puede reaccionar con el aire sin que falte o sobre oxígeno.
SI,automotriz,,,DPM: Siglas de las partículas diesel presentes en las emisiones de escape. Es un agregado complejo de material sólido y líquido.
SI,automotriz,,,"DSA: Opel aplica estas siglas al sistema de suspensión trasera multibrazo que montan los Astra, Vectra y Omega, aunque esta marca también hace referencia a ellas cuando se refiere al conjunto de la suspensión del coche. En Volvo se refiere a dos dispositivos: el control de estabilidad y el Dual Stage Airbag, un sistema de seguridad que infla el airbag en dos fases, dependiendo de la gravedad del impacto."
SI,automotriz,,,DSC: Siglas de Dynamische Stabilitäts Control que significa control de estabilidad dinámico y lo utiliza BMW para denominar a el sistema de control de la estabilidad que emplea.
SI,automotriz,,,DSTC: Siglas utilizadas por Volvo para denominar su control de la estabilidad.
SI,automotriz,,,Dummy: Nombre que reciben los maniquíes utilizados en las pruebas de choque de los vehículos. Simulan el comportamiento del cuerpo humano ante las fuerzas que aparecen durante el choque. Se fabrican en varias tallas y pesos y disponen de varios sensores colocados en su interior para medir las aceleraciones y las presiones de las diferentes partes del vehículo sobre ellos. Su precio puede alcanzar en los más complejos hasta 30 millones de pesetas.
SI,automotriz,,,"Dureza, - pintura -: La dureza de una película se determina por su resistencia ante acciones mecánicas, como penetraciones o rayados. Existen distintos equipos e instrumentos para determinar la resistencia al rayado superficial del esmalte, barniz, etc. Los más extendidos son el durómetro y el durómetro de lápices."
SI,automotriz,,,"Durómetro: Consiste en una varilla que termina en una bola de 0,75 mm de diámetro, que es empujada sobre la superficie a ensayar por un resorte, con mecanismo de regulación de presión. La norma exige que el desplazamiento del instrumento se realice durante un segundo, en una longitud de 10 mm."
SI,automotriz,,,"Durómetro de lápices: Este ensayo se realiza con un juego de lápices, cuya dureza varía desde el más blando (6B) hasta el más duro (6H). Comenzando por los más duros, se deslizan sobre la película con un peso definido. La penetración de la punta, de una determinada dureza, define la resistencia al rayado de la película."
SI,automotriz,,,Easytronic: Nombre que recibe la gestión electrónica de la caja de cambios ASG.
SI,automotriz,,,"EBD: Responde a diversas siglas cuando lo incorporan los distintos fabricantes, como por ejemplo las inglesas EBV. Los repartidores de frenada existen en el automovil para regular la intensidad de la frenada de las ruedas traseras en funcion de la carga que lleve el vehiculo. A mayor peso sobre las ruedas traseras, mas capacidad de frenado puede soportar antes de comenzar a patinar. Tradicionalmente, el sistema era mecanico. La llegada de la electronica, con auxilio de los captadores del ABS, da lugar al repartidor electronico, que permite ajustar de modo mucho mas fino y preciso la cantidad de frenada que le llega a las ruedas posteriores, reduciendo las distancias de frenado y los riesgos de bloqueo por mal funcionamiento."
SI,automotriz,,,"ECC: Para Opel es el climatizador electrónico: un sistema de aire acondicionado controlado electrónicamente. El conductor sólo tiene que fijar la temperatura deseada y él controla automáticamente la capacidad de refrigeración, la cantidad de aire y la ventilación."
SI,automotriz,,,ECS: Suspensión ControladaElectrónicamente. Varía la durezade los amortiguadores en funcióndel terreno y del tipo de conducción. Semejante a los ADS.
SI,automotriz,,,EDC: Control electrónico de la inyección diesel de Bosch.
SI,automotriz,,,"EDS: Bloqueo Electrónico del Diferencial que utilizan Volkswagen, Audi o Seat. En Toyota, sus siglas son LSD."
SI,automotriz,,,"Efecto suelo: La fuerza de rozamiento del neumático con el suelo está en función de la adherencia disponible y del peso del vehículo sobre dicha rueda. Una forma de aumentar la fuerza de rozamiento consiste en incrementar el peso del vehículo utilizando la fuerza del aire sobre los alerones. Pero el peso del vehículo también se puede aumentar creando una depresión por la parte baja del mismo. El efecto suelo se consigue aumentando la velocidad del paso del aire por la parte baja impidiendo (con faldones) que el aire pueda acceder desde los laterales. El aire al pasa tan rápido crea una zona de depresión que arrastra a la carrocería hacia el suelo, aumentando el peso del vehículo sobre las ruedas y por tanto la fuerza de rozamiento del neumático con el suelo. El agarre del coche en zonas de curvas rápidas aumenta permitiendo una velocidad de paso mayor. El efecto suelo también se puede crear facilitando la salida del aire de la parte inferior del vehículo al colocar deflectores en la parte posterior. Se crea entonces una gran depresión en la parte trasera que arrastra al aire contenido en la parte inferior hacia atrás. El efecto suelo aparece cuando la velocidad del vehículo es alta, no teniendo incidencia a bajas velocidades. Este sistema apareció en la fórmula 1 de la mano de Colin Chapman y el Lotus 78 causando una gran revolución tecnológica. En la actualidad este sistema está prohibido en la fórmula 1 y solamente se utiliza en vehículos muy deportivos."
SI,automotriz,,,EGR: Exhaust Gas Recirculation. Sistema de recirculación de gases de escape.
SI,automotriz,,,"EHB: Freno electrohidráulico de Bosch que no convierte directamente la fuerza aplicada por el conductor sobre el pedal de freno en presión hidráulica en el circuito de freno, sino en una señal eléctrica. Usando esta señal junto con otros datos, el sistema de control electrónico del freno procesa individualmente las fuerzas de frenado requeridas en cada rueda. Las correspondientes presiones sobre los frenos se generan entonces en una unidad hidráulica central. Ante la posibilidad de un fallo en el sistema eléctrico, se mantiene una transmisión hidráulica directa como opción de seguridad."
SI,automotriz,,,"EHV: Vidrio especialmente inastillable, resistente a los golpes de martillo y hachas, instalado por BMW en las ventanillas."
SI,automotriz,,,Eje De Dion: Tipo de suspensión similar al eje rígido pero con un menor peso y con menor interferencia entre las ruedas mientras trabaja la suspensión. Utiliza como resorte barras de torsión colocadas de forma perpendicular al sentido de la marcha del automóvil. En algunos modelos se colocan las barras por el interior de un tubo para protegerlas.
SI,automotriz,,,Eje primario: Eje que transmite el movimiento. En un cambio de marchas se denomina eje primario al eje que está conectado a través del embrague con el cigüeñal. Es el que impulsa a los engranajes del cambio.
SI,automotriz,,,Eje secundario: Eje que recibe el movimiento. En un cambio de marchas se denomina eje secundario al eje que está conectado con el diferencial y las ruedas. Es el que recibe el movimiento después de pasar por los engranajes del cambio
SI,automotriz,,,Electrólisis: Proceso químico que se utiliza para disgregar las moléculas de una sustancia cuando pasa por ella una corriente eléctrica. Este proceso se utiliza en la batería de un automóvil para recargarla. El electrolito es la sustancia líquida que se disgrega y los electrodos son las placas que reciben o donan parte de los componentes disgregados.
SI,automotriz,,,"Embrague: Sistema que permite controlar el acoplamiento mecánico entre el motor y la caja de cambios. El embrague permite que se puedan insertar las diferentes marchas o interrumpir la transmisión entre el motor y las ruedas. Los embragues utilizados en los automóviles son por fricción entre un disco solidario con la caja de cambios y de una maza solidaria al cigüeñal del motor. El disco se coloca entre la maza y el volante de inercia y el presionado por un resorte llamado diafragma. Cuando el embrague está sin accionar (motor embragado) el disco tiene un gran rozamiento con la maza y transmite toda la fuerza generada en el motor. Cuando se acciona el embrague (motor desembragado) el diafragma es comprimido por el conductor y el disco queda suelto, siendo incapaz de transmitir la fuerza del motor a la caja de cambios. Según la posición del pedal del embrague se puede conseguir un acoplamiento total (pedal suelto) o acoplamientos parciales (pedal a medio pisar) que nos permiten variar la fuerza transmitida por el motor a la transmisión."
SI,automotriz,,,Embrague autoajustable: Embrague que incorpora entre su carcasa y diafragma cuñas de ajuste que le permiten ir autoajustándose conforme va desgastándose el disco.
SI,automotriz,,,Embrague de fricción: Los embragues de fricción basados en la unión de dos piezas que al adherirse forman el efecto de una sola.
SI,automotriz,,,"Embrague pilotado: Dispositivo que elimina el accionamiento del embrague por parte del conductor. El control del embrague lo realiza una centralita electrónica en función de las acciones del conductor. El embrague pilotado permite realizar los cambios de marcha de forma manual pero sin necesidad de accionar el embrague. Por medio de sensores se conoce el accionamiento de la caja de cambios, la velocidad del vehículo, la forma de accionar el acelerador, las revoluciones del motor y con todos los datos, la centralita acciona una bomba hidráulica que actúa sobre el embrague. También se determina la rapidez de actuación sobre el embrague y el deslizamiento necesario para evitar que se produzcan brusquedades durante el cambio de marchas."
SI,automotriz,,,Embragues electromagnéticos: Embragues que basan su funcionamiento en el principio de los efectos de la acción de los campos magnéticos
SI,automotriz,,,Embragues hidráulicos: Embragues que utilizan como elemento de unión el aceite. Son utilizados generalmente por los vehículos dotados de cambios de velocidades automáticos.
SI,automotriz,,,Encendido: Sistema eléctrico o electrónico del vehículo encargado de suministrar la chispa en el interior del cilindro para la explosión de la mezcla.
SI,automotriz,,,"Encendido Dis: Tipo de Encendido electrónico, que consta de sensores de posición del cigüeñal, unidad de control electrónico, bobina doble, sensor de temperatura del circuito de agua motor y sonda de temperatura de aire. El sistema no cuenta, - lógicamente -, con distribuidor. La unidad de mando es la encargada de procesar la información recibida de los sensores y de cortar la corriente en el primario para generar la alta tensión."
SI,automotriz,,,"Encendido Electrónico: Tipo de sistema de encendido capaz de producir la chispa en la bujía en el momento oportuno. El encendido electrónico consta de bobina, sensores y unidad de mando que analiza las señales de los sensores y realiza el oportuno corte del primario para generar la alta tensión necesaria para producir la chispa en la bujía."
SI,automotriz,,,Encendido por distribuidor: Tipo de sistema de encendido que realiza la distribución de la corriente eléctrica hacia las bujías mediante un distribuidor activado por el árbol de levas del motor. El distribuidor también es el encargado de realizar el corte eléctrico que genera una alta tensión en la bobina.
SI,automotriz,,,"Encendido transistorizado: Tipo de sistema de encendido que incorpora un transistores tipo PNP o NPN, dependiendo de la derivación a masa existente (positivo o negativo) y que puede encontrarse en sistemas de encendido con o sin ruptor, como puede ser mediante un generador de impulsos (hall)."
SI,automotriz,,,"EPG: Enhanced Protective Glass). Es el vidrio laminado que equipa las ventanas laterales y traseras de algunos de los vehículos más modernos y avanzados del mercado. Se trata de un vidrio formado por una lámina de un plástico especial -polivinilo butiral-, ensamblada entre otras dos láminas de vidrio. EPG puede evitar robos, protege a los ocupantes de vehículo en caso de accidente, reduce el calor y el ruido del tráfico en el interior y bloquea la radiación ultravioleta. Está homologado para su utilización en todas las ventanas del vehículo por la ONU en el Reglamento 43 (R43), y por la UE en la Directiva 92/22."
SI,automotriz,,,"Ergonomía: Parte de la ciencia que estudia la relación del cuerpo humano con el medio ambiente que le rodea. En el automóvil se utiliza para facilitar la conducción y reducir el cansancio y las posibles distracciones que puedan sufrir el conductor. También sirve para aumentar el confort de todos los ocupantes. Los estudios ergonómicos determinan la posición de los mandos, la forma de los asientos, las canalizaciones de aire, etc."
SI,automotriz,,,"Escape: Es la fase final del proceso de combustión y comienza cuando se abre la válvula de escape y el pistón asciende desde el Punto Muerto Inferior (PMI) al Punto Muerto Superior (PMS). Los gases quemados salen a la atmósfera a través del conducto de escape por la diferencia de presiones. Al estar los gases todavía calientes en el interior del cilindro, la presión es mayor que la atmosférica y en cuanto se abre la válvula los gases salen. El pistón en su recorrido ascendente termina de barrer los gases cuando la presión desaparece. La fase de escape finaliza dando paso a la fase de admisión."
SI,automotriz,,,ESI-tronic: Información de servicio electrónico de Bosch con soporte en Windows.
SI,automotriz,,,"Espesor: Cada tipo de pintura, dependiendo de su naturaleza, proporciona un espesor concreto de película, tanto en húmedo como en seco. Por esto, es necesario cumplir las especificaciones técnicas facilitadas por los fabricantes de pintura, en cuanto a dilución, viscosidad, número de manos de aplicación, etc. Por lo general, si la capa es superior a la recomendada aumenta el consumo y el riesgo de defectos en el proceso de secado. Por el contrario, si la capa de pintura es inferior, se corre el riesgo de que el poder cubriente y el brillo no sean satisfactorios. En ambos casos, afecta a la flexibilidad y a la dureza. Los micrómetros se utilizan para comprobar el espesor de la película de pintura seca. Existen varios tipos de estos medidores, pero los más utilizados son los magnéticos y los electrónicos. Los primeros consisten en un imán y un resorte que trabaja en sentido contrario; cuando el espesor es pequeño, el imán ofrece más atracción y, si por el contrario, el espesor es grande, la atracción se reduce. Los electrónicos, basados en el mismo principio, son los medidores más fiables y cómodos."
SI,automotriz,,,Espumosidad: Propiedad del aceite a crear espuma cuando es batido o tiene entradas de aire. Se mide según la norma ASTM-D-892.
SI,automotriz,,,"Estampación: Fabricación de piezas mediante la presión de un molde sobre una plancha de materia prima. Al cesar la presión del molde, a pieza adquiere una determinada forma según las matrices utilizadas. Es el método utilizado para conformar las piezas de la carrocería."
SI,automotriz,,,Estequiometría: Parte de la química encargada del estudio de las proporciones definidas.
SI,automotriz,,,Estribo: Pieza colocada por debajo de las puertas y que facilita la subida o bajada de los pasajeros al apoyar el pie sobre él. Se utiliza en los vehículos con acceso complicado a causa de su altura como camiones o todoterrenos.
